物件名,住所,アクセス,築年数,階数,家賃,管理費,間取り,広さ
アーバン増渕,東京都品川区西品川２,ＪＲ埼京線/大崎駅 歩10分 東急大井町線/下神明駅 歩10分 都営浅草線/戸越駅 歩16分,築38年,2階,15万円,5000円,1LDK,50.84m2
パークリュクス渋谷西原,東京都渋谷区西原１,京王新線/幡ヶ谷駅 歩1分 東京メトロ千代田線/代々木上原駅 歩12分 京王線/笹塚駅 歩14分,築7年,5階,28万円,10000円,2LDK,55.63m2
メゾン三池,東京都新宿区西早稲田２,東京メトロ副都心線/西早稲田駅 歩4分 ＪＲ山手線/高田馬場駅 歩10分 東京メトロ東西線/早稲田駅 歩11分,築15年,1階,13.6万円,0円,2K,56.47m2
オープンレジデンシア恵比寿コート,東京都渋谷区恵比寿２,ＪＲ山手線/恵比寿駅 歩13分 東京メトロ日比谷線/広尾駅 歩9分 ＪＲ山手線/目黒駅 歩25分,新築,3階,26.6万円,20000円,2LDK,43.2m2
My Style高田馬場壱番館,東京都新宿区高田馬場４,ＪＲ山手線/高田馬場駅 歩6分 東京メトロ副都心線/西早稲田駅 歩12分 ＪＲ中央線/大久保駅 歩16分,築2年,3階,13.6万円,3000円,1LDK,32.25m2
ＪＲ山手線 高田馬場駅 3階建 築2年,東京都新宿区高田馬場４,ＪＲ山手線/高田馬場駅 歩6分 東京メトロ副都心線/西早稲田駅 歩12分 ＪＲ中央線/大久保駅 歩16分,築2年,3階,13.6万円,3000円,1LDK,32.25m2
梅里大同マンション,東京都杉並区梅里２,東京メトロ丸ノ内線/新高円寺駅 歩6分 東京メトロ丸ノ内線/南阿佐ケ谷駅 歩10分 ＪＲ中央線/高円寺駅 歩16分,築50年,4階,9万円,5000円,1LDK,34.77m2
エル・セレーノ西早稲田,東京都新宿区西早稲田２,東京メトロ副都心線/西早稲田駅 歩4分 東京メトロ東西線/高田馬場駅 歩10分 東京メトロ東西線/早稲田駅 歩13分,築22年,4階,13.1万円,10000円,1LDK,38.25m2
グランド神楽坂,東京都新宿区赤城下町,東京メトロ東西線/神楽坂駅 歩5分 東京メトロ有楽町線/江戸川橋駅 歩5分 都営大江戸線/牛込神楽坂駅 歩14分,新築,5階,22.4万円,15000円,2DK,50.41m2
東急目黒線 洗足駅 8階建 築34年,東京都大田区北千束１,東急目黒線/洗足駅 歩6分 東急目黒線/大岡山駅 歩10分 東急目黒線/西小山駅 歩16分,築34年,6階,10.9万円,3000円,2DK,32.48m2
スタジオスクエア洗足,東京都大田区北千束１,東急目黒線/洗足駅 歩6分 東急目黒線/大岡山駅 歩10分 東急目黒線/西小山駅 歩16分,築34年,6階,10.9万円,3000円,2DK,32.48m2
第二サンライズハイツ,東京都目黒区鷹番２,東急東横線/学芸大学駅 歩3分 東急東横線/祐天寺駅 歩13分 東急目黒線/武蔵小山駅 バス11分 (バス停)学芸大学駅 歩2分,築36年,2階,14万円,0円,2DK,41.85m2
インプルーブ西馬込,東京都大田区西馬込１,都営浅草線/西馬込駅 歩5分 都営浅草線/馬込駅 歩10分 東急池上線/長原駅 歩26分,築33年,5階,21.9万円,10000円,2LDK,63.14m2
オルタナ新宿中落合,東京都新宿区中落合３,都営大江戸線/落合南長崎駅 歩9分 西武池袋線/椎名町駅 歩10分 東京メトロ東西線/落合駅 歩17分,築4年,4階,11.4万円,15000円,2K,25.51m2
パークハウス渋谷山手,東京都目黒区青葉台４,ＪＲ山手線/渋谷駅 歩12分 東京メトロ日比谷線/中目黒駅 歩19分 京王井の頭線/神泉駅 歩5分,築24年,10階,20万円,0円,1LDK,42.49m2
パークヒルズ田園調布,東京都大田区田園調布４,東急東横線/田園調布駅 歩7分 東急目黒線/多摩川駅 歩10分 東急大井町線/自由が丘駅 歩19分,築29年,2階,12.8万円,5000円,1LDK,37.26m2
レジディア大森III,東京都大田区大森北１,ＪＲ京浜東北線/大森駅 歩2分 京急本線/大森海岸駅 歩10分 京急本線/平和島駅 歩20分,築12年,9階,17万円,10000円,1LDK,37.59m2
ＪＲ京浜東北線 大森駅 14階建 築12年,東京都大田区大森北１,ＪＲ京浜東北線/大森駅 歩2分 京急本線/大森海岸駅 歩10分 ＪＲ横須賀線/西大井駅 歩27分,築12年,9階,17万円,10000円,1LDK,37.59m2
河田町ガーデン 2号棟,東京都新宿区河田町,都営新宿線/曙橋駅 歩4分 都営大江戸線/若松河田駅 歩6分 東京メトロ丸ノ内線/四谷三丁目駅 歩15分,築21年,12階,27.06万円,10000円,1SLDK,63.87m2
第二サンライズハイツ,東京都目黒区鷹番２,東急東横線/学芸大学駅 歩3分 東急東横線/祐天寺駅 歩13分 東急目黒線/武蔵小山駅 バス11分 (バス停)学芸大学駅 歩2分,築36年,2階,14万円,0円,2DK,41.85m2
ヒルズ高輪柘榴坂,東京都港区高輪４,ＪＲ山手線/品川駅 歩8分 都営浅草線/高輪台駅 歩7分 ＪＲ山手線/五反田駅 歩16分,築27年,2階,24万円,18700円,1LDK,53.2m2
My Style高田馬場壱番館,東京都新宿区高田馬場４,ＪＲ山手線/高田馬場駅 歩6分 東京メトロ副都心線/西早稲田駅 歩12分 ＪＲ中央線/大久保駅 歩16分,築2年,3階,13.6万円,3000円,1LDK,32.25m2
ＪＲ山手線 高田馬場駅 3階建 築2年,東京都新宿区高田馬場４,ＪＲ山手線/高田馬場駅 歩6分 東京メトロ副都心線/西早稲田駅 歩12分 ＪＲ中央線/大久保駅 歩16分,築2年,3階,13.6万円,3000円,1LDK,32.25m2
プライムアート白金台,東京都港区白金台５,東京メトロ南北線/白金台駅 歩8分 ＪＲ山手線/目黒駅 歩17分 都営三田線/白金高輪駅 歩18分,築4年,4階,22.4万円,20000円,1LDK,38.97m2
デュオステージ新高円寺,東京都杉並区梅里１,東京メトロ丸ノ内線/新高円寺駅 歩3分 東京メトロ丸ノ内線/東高円寺駅 歩8分 ＪＲ中央線/高円寺駅 歩13分,築4年,5階,10.3万円,12000円,1K,26.5m2
パークハウス渋谷山手,東京都目黒区青葉台４,ＪＲ山手線/渋谷駅 歩12分 東京メトロ日比谷線/中目黒駅 歩19分 京王井の頭線/神泉駅 歩5分,築24年,10階,20万円,0円,1LDK,42.49m2
エル・セレーノ西早稲田,東京都新宿区西早稲田２,東京メトロ副都心線/西早稲田駅 歩4分 東京メトロ東西線/高田馬場駅 歩10分 東京メトロ東西線/早稲田駅 歩13分,築22年,4階,13.1万円,10000円,1LDK,38.25m2
レジディア広尾II,東京都渋谷区広尾５,東京メトロ日比谷線/広尾駅 歩7分 ＪＲ山手線/恵比寿駅 歩12分 東京メトロ南北線/白金台駅 歩21分,築19年,12階,23万円,15000円,1LDK,42.64m2
グランド神楽坂,東京都新宿区赤城下町,東京メトロ東西線/神楽坂駅 歩5分 東京メトロ有楽町線/江戸川橋駅 歩5分 都営大江戸線/牛込神楽坂駅 歩14分,新築,5階,22.4万円,15000円,2DK,50.41m2
東急池上線 雪が谷大塚駅 6階建 築7年,東京都大田区田園調布本町,東急池上線/雪が谷大塚駅 歩8分 東急多摩川線/沼部駅 歩11分 東急東横線/多摩川駅 歩14分,築7年,3階,11万円,5000円,1LDK,35.02m2
京急本線 大森海岸駅 8階建 築52年,東京都品川区南大井３,京急本線/大森海岸駅 歩2分 ＪＲ京浜東北線/大森駅 歩8分 東京モノレール/大井競馬場前駅 バス7分 (バス停)大森海岸駅 歩3分,築52年,7階,12.5万円,6000円,1LDK,39.65m2
TS大森ハイム,東京都品川区南大井３,京急本線/大森海岸駅 歩2分 ＪＲ京浜東北線/大森駅 歩8分 東京モノレール/大井競馬場前駅 バス7分 (バス停)大森海岸駅 歩3分,築52年,7階,12.5万円,6000円,1LDK,39.65m2
オルタナ新宿中落合,東京都新宿区中落合３,都営大江戸線/落合南長崎駅 歩9分 西武池袋線/椎名町駅 歩10分 東京メトロ東西線/落合駅 歩17分,築4年,4階,11.4万円,15000円,2K,25.51m2
河田町ガーデン 2号棟,東京都新宿区河田町,都営新宿線/曙橋駅 歩4分 都営大江戸線/若松河田駅 歩6分 東京メトロ丸ノ内線/四谷三丁目駅 歩15分,築21年,12階,27.06万円,10000円,1SLDK,63.87m2
ルーブル北嶺町,東京都大田区北嶺町,東急池上線/御嶽山駅 歩3分 東急池上線/雪が谷大塚駅 歩5分 東急多摩川線/沼部駅 歩13分,新築,1階,13.5万円,14000円,1SDK,40.48m2
ホソノマンション,東京都杉並区阿佐谷南３,ＪＲ中央線/阿佐ケ谷駅 歩7分 ＪＲ中央線/荻窪駅 歩10分 東京メトロ丸ノ内線/南阿佐ケ谷駅 歩14分,築47年,4階,8.3万円,3000円,2DK,36.43m2
CYNTHIA FOUR-D HATAGAYA,東京都渋谷区幡ヶ谷１,京王新線/幡ヶ谷駅 歩4分 京王線/笹塚駅 歩8分 東京メトロ千代田線/代々木上原駅 歩15分,築19年,9階,8.1万円,10000円,1K,20.82m2
第5丸仙ハイツ,東京都大田区東雪谷２,東急池上線/石川台駅 歩2分 東急目黒線/大岡山駅 歩14分 東急大井町線/北千束駅 歩22分,築18年,2階,16万円,6000円,2LDK,56m2
イニシアイオ芝公園,東京都港区芝２,都営三田線/三田駅 歩7分 ＪＲ山手線/田町駅 歩11分 新交通ゆりかもめ/日の出駅 歩14分,築13年,2階,14.3万円,12000円,1DK,31.36m2
都営三田線 三田駅 14階建 築13年,東京都港区芝２,都営三田線/三田駅 歩7分 ＪＲ山手線/田町駅 歩11分 新交通ゆりかもめ/日の出駅 歩14分,築13年,2階,14.3万円,12000円,1DK,31.36m2
東急東横線 中目黒駅 10階建 築57年,東京都目黒区青葉台３,東急東横線/中目黒駅 歩10分 東急田園都市線/池尻大橋駅 歩7分 京王井の頭線/神泉駅 歩14分,築57年,5階,11.5万円,7000円,1LDK,32.13m2
ルジェンテ新宿御苑前,東京都新宿区新宿５,東京メトロ丸ノ内線/新宿御苑前駅 歩8分 都営新宿線/新宿三丁目駅 歩9分 都営新宿線/曙橋駅 歩15分,築2年,13階,20万円,10000円,1LDK,39.05m2
クリオ三田ラ・モード,東京都港区芝５,都営三田線/三田駅 歩3分 ＪＲ山手線/田町駅 歩4分 都営大江戸線/赤羽橋駅 歩13分,築20年,6階,15.6万円,10000円,1DK,32.2m2
都営三田線 三田駅 11階建 築20年,東京都港区芝５,都営三田線/三田駅 歩3分 ＪＲ山手線/田町駅 歩4分 都営大江戸線/赤羽橋駅 歩13分,築20年,6階,15.6万円,10000円,1DK,32.2m2
Y′s Flat 芝公園,東京都港区芝２,都営三田線/芝公園駅 歩1分 ＪＲ山手線/浜松町駅 歩13分 都営浅草線/三田駅 歩6分,築9年,3階,11.4万円,5000円,ワンルーム,31.75m2
ミリアレジデンス西蒲田,東京都大田区西蒲田６,東急池上線/蓮沼駅 歩5分 ＪＲ京浜東北線/蒲田駅 歩9分 東急多摩川線/矢口渡駅 歩15分,築33年,5階,23.5万円,10000円,3DK,65.6m2
エスティメゾン北新宿,東京都新宿区北新宿１,ＪＲ中央線/大久保駅 歩5分 ＪＲ山手線/新大久保駅 歩9分 西武新宿線/西武新宿駅 歩13分,築20年,9階,40万円,20000円,2LDK,87.8m2
パレセーヌ平町,東京都目黒区平町１,東急東横線/都立大学駅 歩3分 東急目黒線/大岡山駅 歩19分 東急大井町線/緑が丘駅 歩19分,築35年,1階,9.7万円,3000円,2K,34.02m2
エムアンドエヌビルディング,東京都新宿区市谷台町,都営新宿線/曙橋駅 歩2分 東京メトロ丸ノ内線/四谷三丁目駅 歩9分 都営大江戸線/若松河田駅 歩12分,築1年,8階,28万円,10000円,2LDK,54.38m2
都営三田線 三田駅 14階建 築13年,東京都港区芝２,都営三田線/三田駅 歩7分 ＪＲ山手線/田町駅 歩11分 新交通ゆりかもめ/日の出駅 歩14分,築13年,2階,14.3万円,12000円,1DK,31.36m2
ウエストポイントコート,東京都新宿区信濃町,ＪＲ中央線/信濃町駅 歩6分 東京メトロ丸ノ内線/四谷三丁目駅 歩9分 都営大江戸線/国立競技場駅 歩12分,築35年,3階,22.8万円,0円,2LDK,73.99m2
コスモ碑文谷,東京都目黒区碑文谷３,東急東横線/都立大学駅 歩8分 東急東横線/学芸大学駅 歩17分 東急目黒線/大岡山駅 歩18分,築36年,1階,32万円,0円,2LDK,81m2
パセオ四谷三丁目,東京都新宿区舟町,東京メトロ丸ノ内線/四谷三丁目駅 歩4分 都営新宿線/曙橋駅 歩5分 東京メトロ丸ノ内線/新宿御苑前駅 歩14分,築3年,1階,20.9万円,20000円,1LDK,47.3m2
若葉ビューアパートメント,東京都新宿区若葉１,ＪＲ中央線/四ツ谷駅 歩8分 東京メトロ丸ノ内線/四谷三丁目駅 歩13分 都営新宿線/曙橋駅 歩20分,新築,1階,22.5万円,15000円,1SLDK,44.59m2
La Plage,東京都大田区鵜の木２,東急多摩川線/鵜の木駅 歩4分 東急池上線/久が原駅 歩14分 東急多摩川線/下丸子駅 歩13分,築4年,1階,12.2万円,6000円,1LDK,38.6m2
クリオ三田ラ・モード,東京都港区芝５,都営三田線/三田駅 歩3分 ＪＲ山手線/田町駅 歩4分 都営大江戸線/赤羽橋駅 歩13分,築20年,6階,15.6万円,10000円,1DK,32.2m2
都営三田線 三田駅 11階建 築20年,東京都港区芝５,都営三田線/三田駅 歩3分 ＪＲ山手線/田町駅 歩4分 都営大江戸線/赤羽橋駅 歩13分,築20年,6階,15.6万円,10000円,1DK,32.2m2
フロンティア新宿タワー,東京都新宿区西新宿３,京王新線/初台駅 歩5分 ＪＲ山手線/新宿駅 歩14分 小田急線/参宮橋駅 歩9分,築6年,18階,34.3万円,20000円,1LDK,57.08m2
Y′s Flat 芝公園,東京都港区芝２,都営三田線/芝公園駅 歩1分 ＪＲ山手線/浜松町駅 歩13分 都営浅草線/三田駅 歩6分,築9年,3階,11.4万円,5000円,ワンルーム,31.75m2
ツインツリーズ桜丘,東京都世田谷区桜丘２,小田急線/千歳船橋駅 歩5分 小田急線/経堂駅 歩15分 東急世田谷線/宮の坂駅 歩23分,築8年,1階,10.6万円,3000円,1LDK,30.24m2
ジオエント山吹神楽坂,東京都新宿区山吹町,東京メトロ有楽町線/江戸川橋駅 歩4分 東京メトロ東西線/神楽坂駅 歩7分 都営大江戸線/牛込神楽坂駅 歩14分,新築,2階,21.1万円,15000円,1LDK,40.28m2
トーレタケダ,東京都大田区北千束３,東急目黒線/大岡山駅 歩4分 東急大井町線/北千束駅 歩9分 東急池上線/洗足池駅 歩12分,築29年,3階,11.3万円,5000円,1LDK,33.4m2
コンフォリア早稲田DEUX,東京都新宿区弁天町,都営大江戸線/牛込柳町駅 歩4分 東京メトロ東西線/早稲田駅 歩8分 都営新宿線/曙橋駅 歩15分,築24年,1階,13.9万円,7000円,2DK,40.32m2
スクエアコート早稲田,東京都新宿区西早稲田３,東京メトロ副都心線/西早稲田駅 歩9分 東京メトロ東西線/早稲田駅 歩9分 ＪＲ山手線/高田馬場駅 歩15分,築3年,1階,18万円,10000円,1LDK,42.2m2
小田急線 東北沢駅 10階建 築21年,東京都渋谷区上原２,小田急線/東北沢駅 歩9分 東京メトロ千代田線/代々木上原駅 歩11分 京王井の頭線/池ノ上駅 歩12分,築21年,5階,16.6万円,10000円,1LDK,35.58m2
ＪＲ中央線 荻窪駅 地下1地上19階建 築26年,東京都杉並区荻窪５,ＪＲ中央線/荻窪駅 歩2分 ＪＲ総武線/阿佐ケ谷駅 歩19分 東京メトロ丸ノ内線/南阿佐ケ谷駅 歩20分,築26年,13階,19万円,8000円,2LDK,61.81m2
Abode Azabu,東京都港区元麻布３,東京メトロ日比谷線/六本木駅 歩9分 東京メトロ南北線/麻布十番駅 歩10分 東京メトロ日比谷線/広尾駅 歩13分,築32年,1階,17.8万円,10000円,1LDK,47.2m2
ステイン バァウ,東京都新宿区大京町,東京メトロ丸ノ内線/四谷三丁目駅 歩5分 ＪＲ中央線/信濃町駅 歩8分 都営大江戸線/国立競技場駅 歩13分,築26年,3階,15.2万円,6000円,2DK,44.1m2
プレミアムキューブG西大井,東京都品川区二葉３,ＪＲ横須賀線/西大井駅 歩5分 都営浅草線/中延駅 歩12分 都営浅草線/馬込駅 歩14分,築8年,4階,9万円,15000円,ワンルーム,20.94m2
レジデンス浜田山,東京都杉並区浜田山３,京王井の頭線/浜田山駅 歩5分 京王井の頭線/高井戸駅 歩15分 京王線/上北沢駅 歩26分,築28年,6階,13.3万円,6000円,2DK,45m2
メイクスデザイン白金台,東京都港区白金台２,都営浅草線/高輪台駅 歩5分 東京メトロ南北線/白金台駅 歩9分 ＪＲ山手線/五反田駅 歩12分,築24年,2階,8.5万円,13000円,1K,22.18m2
東京メトロ有楽町線 江戸川橋駅 6階建 築5年,東京都新宿区山吹町,東京メトロ有楽町線/江戸川橋駅 歩5分 東京メトロ東西線/神楽坂駅 歩8分 ＪＲ中央線/飯田橋駅 歩21分,築5年,4階,12.45万円,16000円,1DK,25.74m2
ハーモニーレジデンス神楽坂ヒルズｓｅｃｏｎｄ,東京都新宿区山吹町,東京メトロ有楽町線/江戸川橋駅 歩5分 東京メトロ東西線/神楽坂駅 歩8分 ＪＲ中央線/飯田橋駅 歩21分,築5年,4階,12.45万円,16000円,1DK,25.74m2
東京メトロ有楽町線 市ケ谷駅 5階建 築3年,東京都新宿区市谷鷹匠町,東京メトロ有楽町線/市ケ谷駅 歩7分 都営大江戸線/牛込神楽坂駅 歩8分 ＪＲ中央線/市ケ谷駅 歩11分,築3年,3階,13.2万円,10000円,1DK,25.13m2
レジディアタワー乃木坂,東京都港区赤坂９,東京メトロ千代田線/乃木坂駅 歩1分 東京メトロ日比谷線/六本木駅 歩6分 東京メトロ千代田線/赤坂駅 歩11分,築20年,6階,22.9万円,15000円,1LDK,41.45m2
CREVISTA蒲田,東京都大田区西蒲田６,ＪＲ京浜東北線/蒲田駅 歩6分 東急池上線/蓮沼駅 歩2分 京急本線/京急蒲田駅 歩18分,築5年,2階,9.6万円,15000円,1K,25.24m2
空と海,東京都大田区東六郷１,京急本線/雑色駅 歩6分 京急本線/京急蒲田駅 歩8分 ＪＲ京浜東北線/蒲田駅 歩18分,築6年,2階,9.5万円,8000円,1K,29.29m2
ローズガーデンテラス,東京都新宿区西新宿８,東京メトロ丸ノ内線/西新宿駅 歩5分 ＪＲ中央線/大久保駅 歩7分 ＪＲ山手線/新宿駅 歩11分,築28年,5階,14.2万円,8000円,1LDK,37.91m2
ルナクレスト１,東京都新宿区北新宿３,ＪＲ中央線/大久保駅 歩6分 ＪＲ山手線/新大久保駅 歩10分 ＪＲ中央線/東中野駅 歩11分,築18年,3階,9.2万円,5000円,1DK,29.11m2
ルナクレスト１,東京都新宿区北新宿３,ＪＲ中央線/大久保駅 歩6分 ＪＲ山手線/新大久保駅 歩10分 ＪＲ中央線/東中野駅 歩11分,築18年,3階,9.2万円,5000円,1DK,29.11m2
ジョイフル大森,東京都品川区南大井３,ＪＲ京浜東北線/大森駅 歩6分 京急本線/大森海岸駅 歩3分 京急本線/立会川駅 歩16分,築30年,7階,6.4万円,5000円,ワンルーム,16.39m2
プライムアーバン神楽坂,東京都新宿区山吹町,東京メトロ有楽町線/江戸川橋駅 歩3分 東京メトロ東西線/神楽坂駅 歩8分 都営大江戸線/牛込神楽坂駅 歩15分,築16年,9階,18.2万円,8000円,1LDK,38.61m2
CREVISTA蒲田,東京都大田区西蒲田６,ＪＲ京浜東北線/蒲田駅 歩6分 東急池上線/蓮沼駅 歩2分 京急本線/京急蒲田駅 歩18分,築5年,2階,9.6万円,15000円,1K,25.24m2
空と海,東京都大田区東六郷１,京急本線/雑色駅 歩6分 京急本線/京急蒲田駅 歩8分 ＪＲ京浜東北線/蒲田駅 歩18分,築6年,2階,9.5万円,8000円,1K,29.29m2
ヒルトップ高輪,東京都港区高輪１,都営三田線/白金高輪駅 歩5分 都営浅草線/泉岳寺駅 歩5分 ＪＲ山手線/品川駅 歩22分,築50年,3階,15万円,5000円,2DK,40.1m2
ルベールデュソレイユ,東京都港区白金３,東京メトロ南北線/白金高輪駅 歩8分 東京メトロ日比谷線/広尾駅 歩14分 ＪＲ山手線/恵比寿駅 歩22分,築22年,4階,35万円,10000円,2LDK,72.83m2
PASEO西新宿五丁目II,東京都渋谷区本町４,都営大江戸線/西新宿五丁目駅 歩5分 京王新線/初台駅 歩13分 東京メトロ丸ノ内線/中野新橋駅 歩12分,築2年,3階,10.8万円,12000円,1K,22.94m2
両国グリーンハイツ,東京都墨田区緑３,都営大江戸線/両国駅 歩9分 都営新宿線/菊川駅 歩11分 ＪＲ総武線/両国駅 歩9分,築39年,2階,6.3万円,2000円,ワンルーム,15m2
クレセント代田,東京都世田谷区代田３,小田急線/世田谷代田駅 歩11分 小田急線/梅ヶ丘駅 歩13分 東急世田谷線/若林駅 歩8分,築30年,3階,15万円,0円,2LDK,50m2
河田町ガーデン 4号棟,東京都新宿区河田町,都営新宿線/曙橋駅 歩6分 都営大江戸線/若松河田駅 歩9分 東京メトロ丸ノ内線/四谷三丁目駅 歩12分,築21年,5階,22.73万円,10000円,1LDK,56.64m2
西山ビル,東京都杉並区上井草３,西武新宿線/上井草駅 歩2分 西武新宿線/上石神井駅 歩19分 ＪＲ中央線/荻窪駅 バス22分 (バス停)上井草駅 歩1分,築21年,2階,11.4万円,5000円,2DK,50.7m2
東京メトロ丸ノ内線 西新宿駅 3階建 築10年,東京都新宿区北新宿１,東京メトロ丸ノ内線/西新宿駅 歩6分 ＪＲ中央線/大久保駅 歩8分 ＪＲ山手線/新宿駅 歩14分,築10年,3階,9.5万円,3000円,1K,28.84m2
レジデンスＫ,東京都新宿区北新宿１,東京メトロ丸ノ内線/西新宿駅 歩6分 ＪＲ中央線/大久保駅 歩8分 ＪＲ山手線/新宿駅 歩14分,築10年,3階,9.5万円,3000円,1K,28.84m2
パークアクシス千歳船橋,東京都世田谷区船橋３,小田急線/千歳船橋駅 歩10分 小田急線/経堂駅 歩16分 京王線/上北沢駅 歩25分,築1年,1階,14.9万円,10000円,1LDK,40.11m2
小田急線 千歳船橋駅 6階建 新築,東京都世田谷区船橋３,小田急線/千歳船橋駅 歩10分 小田急線/経堂駅 歩16分 小田急線/祖師ヶ谷大蔵駅 歩28分,新築,1階,22.5万円,15000円,2SLDK,65.65m2
ＬｉｖｅＦｌａｔ不動前,東京都品川区荏原１,東急目黒線/不動前駅 歩10分 都営浅草線/戸越駅 歩14分 東急池上線/戸越銀座駅 歩12分,築2年,4階,13.9万円,12000円,1DK,30.92m2
東急目黒線 不動前駅 4階建 築2年,東京都品川区荏原１,東急目黒線/不動前駅 歩10分 都営浅草線/戸越駅 歩14分 東急池上線/戸越銀座駅 歩12分,築2年,4階,13.9万円,12000円,1DK,30.92m2
ＵＲアクティ芦花公園,東京都世田谷区南烏山２,京王線/芦花公園駅 歩3分 京王線/千歳烏山駅 歩10分 ,築17年,6階,16.69万円,5200円,1LDK,50.73m2
京王線 下高井戸駅 4階建 築8年,東京都世田谷区松原３,京王線/下高井戸駅 歩1分 京王線/明大前駅 歩10分 東急世田谷線/松原駅 歩11分,築8年,3階,13.1万円,0円,1LDK,38.02m2
プライムアーバン四谷外苑東,東京都新宿区左門町,東京メトロ丸ノ内線/四谷三丁目駅 歩4分 ＪＲ中央線/信濃町駅 歩8分 都営新宿線/曙橋駅 歩12分,築20年,12階,18.4万円,7000円,1LDK,44.59m2
ＪＲ山手線 恵比寿駅 7階建 新築,東京都渋谷区東４,ＪＲ山手線/恵比寿駅 歩14分 ＪＲ山手線/渋谷駅 歩15分 西武新宿線/西武新宿駅 歩6分,新築,2階,18万円,18000円,1LDK,34.85m2
ラ・カーサ広尾,東京都渋谷区東４,ＪＲ山手線/恵比寿駅 歩14分 ＪＲ山手線/渋谷駅 歩15分 西武新宿線/西武新宿駅 歩6分,新築,2階,18万円,18000円,1LDK,34.85m2
ベルメゾン尾山台駅前,東京都世田谷区等々力４,東急大井町線/尾山台駅 歩2分 東急大井町線/等々力駅 歩7分 東急田園都市線/駒沢大学駅 バス17分 (バス停)等々力 歩8分,築9年,3階,16.1万円,9000円,1LDK,44.23m2
恵比寿パークサイドヒルズ,東京都渋谷区恵比寿２,ＪＲ山手線/恵比寿駅 歩9分 東京メトロ日比谷線/広尾駅 歩7分 東急東横線/代官山駅 歩18分,築5年,3階,11万円,10000円,ワンルーム,20.01m2
プラウド市谷柳町,東京都新宿区市谷柳町,都営大江戸線/牛込柳町駅 歩2分 都営新宿線/曙橋駅 歩10分 東京メトロ東西線/早稲田駅 歩14分,築14年,4階,18万円,10000円,1LDK,42.44m2
ハビテ外苑,東京都新宿区南元町,ＪＲ中央線/信濃町駅 歩6分 ＪＲ中央線/四ツ谷駅 歩11分 都営大江戸線/青山一丁目駅 歩11分,新築,2階,17.9万円,8000円,1LDK,35.29m2
ザイマックス新宿御苑レジデンス,東京都新宿区新宿１,東京メトロ丸ノ内線/新宿御苑前駅 歩3分 都営新宿線/新宿三丁目駅 歩9分 ＪＲ山手線/新宿駅 歩15分,築23年,9階,26.8万円,10000円,2LDK,70.69m2
ルクレ西新宿,東京都新宿区西新宿４,都営大江戸線/西新宿五丁目駅 歩3分 京王新線/初台駅 歩10分 都営大江戸線/都庁前駅 歩12分,築9年,14階,21.1万円,12000円,1LDK,40.78m2
フラット羽根木,東京都世田谷区羽根木１,京王井の頭線/新代田駅 歩6分 京王線/代田橋駅 歩9分 小田急線/下北沢駅 歩12分,築35年,2階,10.7万円,3000円,2DK,34m2
ザイマックス新宿御苑レジデンス,東京都新宿区新宿１,東京メトロ丸ノ内線/新宿御苑前駅 歩3分 都営新宿線/新宿三丁目駅 歩9分 ＪＲ山手線/新宿駅 歩15分,築23年,9階,26.8万円,10000円,2LDK,70.69m2
ルクレ西新宿,東京都新宿区西新宿４,都営大江戸線/西新宿五丁目駅 歩3分 京王新線/初台駅 歩10分 都営大江戸線/都庁前駅 歩12分,築9年,14階,21.1万円,12000円,1LDK,40.78m2
ＢＯＫＫＥＮ　ＳＥＩＹＯＤＯ,東京都世田谷区三軒茶屋１,東急田園都市線/三軒茶屋駅 歩1分 東急世田谷線/西太子堂駅 歩9分 東急世田谷線/若林駅 歩17分,築11年,3階,14.8万円,0円,1LDK,35.46m2
