物件名,住所,アクセス,築年数,階数,家賃,管理費,間取り,広さ
ジーベック平和島II,東京都大田区大森西３,京急本線/平和島駅 歩6分 京急本線/大森町駅 歩5分 ＪＲ京浜東北線/蒲田駅 バス12分 (バス停)富士見橋 歩7分,築9年,7階,7.7万円,15000円,1K,25.48m2
アイル大森壱番館,東京都大田区大森北１,ＪＲ京浜東北線/大森駅 歩6分 京急本線/大森海岸駅 歩8分 京急本線/平和島駅 歩16分,築10年,6階,7.5万円,10000円,1K,21.75m2
恵比寿スカイハイツ,東京都渋谷区恵比寿西２,ＪＲ山手線/恵比寿駅 歩7分 東急東横線/代官山駅 歩10分 ＪＲ山手線/渋谷駅 歩12分,築46年,3階,19万円,8400円,1LDK,46.23m2
クリオ市谷柳町,東京都新宿区市谷柳町,都営大江戸線/牛込柳町駅 歩1分 都営新宿線/曙橋駅 歩11分 東京メトロ東西線/早稲田駅 歩17分,築3年,10階,15.9万円,10000円,1LDK,30.89m2
XEBEC大森WEST,東京都大田区大森西３,京急本線/大森町駅 歩6分 京急本線/平和島駅 歩6分 ＪＲ京浜東北線/蒲田駅 バス13分 (バス停)大森警察署 歩9分,築11年,7階,6.8万円,15000円,1K,21.13m2
カーサスプレンディッド南麻布フラット,東京都港区南麻布１,東京メトロ南北線/麻布十番駅 歩8分 都営三田線/白金高輪駅 歩12分 都営大江戸線/赤羽橋駅 歩17分,築4年,2階,26.7万円,15000円,1LDK,40.41m2
京成押上線 京成曳舟駅 3階建 築43年,東京都墨田区八広２,京成押上線/京成曳舟駅 歩10分 東武亀戸線/小村井駅 歩8分 東武伊勢崎線/曳舟駅 歩16分,築43年,3階,6万円,3000円,1DK,26.11m2
ヨークレジデンス,東京都世田谷区上馬２,東急田園都市線/三軒茶屋駅 歩10分 東急世田谷線/西太子堂駅 歩10分 東急田園都市線/駒沢大学駅 歩12分,築21年,2階,19.3万円,0円,1LDK,46.42m2
クレシェンド東新宿,東京都新宿区新宿７,都営大江戸線/若松河田駅 歩7分 東京メトロ副都心線/東新宿駅 歩8分 東京メトロ丸ノ内線/新宿三丁目駅 歩13分,新築,1階,9.9万円,10000円,1K,25.42m2
竹中マンション,東京都新宿区上落合２,東京メトロ東西線/落合駅 歩3分 西武新宿線/中井駅 歩7分 ＪＲ中央線/東中野駅 歩10分,築51年,2階,9.2万円,3000円,2K,32.54m2
Uフラッツ,東京都新宿区西落合４,西武池袋線/東長崎駅 歩8分 都営大江戸線/落合南長崎駅 歩10分 西武新宿線/新井薬師前駅 歩22分,築33年,2階,9.3万円,5000円,2DK,42.99m2
品川シーサイドビュータワー1,東京都品川区東品川４,りんかい線/品川シーサイド駅 歩1分 京急本線/青物横丁駅 歩11分 ＪＲ京浜東北線/大井町駅 歩20分,築21年,18階,18.5万円,12000円,1LDK,50.58m2
さつきビル,東京都新宿区住吉町,都営新宿線/曙橋駅 歩3分 都営大江戸線/若松河田駅 歩8分 東京メトロ丸ノ内線/四谷三丁目駅 歩9分,築54年,3階,8.9万円,10000円,2K,28m2
サウスコート阿佐谷,東京都杉並区阿佐谷南１,ＪＲ中央線/阿佐ケ谷駅 歩5分 東京メトロ丸ノ内線/南阿佐ケ谷駅 歩4分 西武新宿線/鷺ノ宮駅 バス5分 (バス停)阿佐ヶ谷駅 歩6分,築37年,5階,9.8万円,5000円,1DK,29.16m2
シンシア三軒茶屋レジデンスカフェ,東京都世田谷区太子堂２,東急田園都市線/三軒茶屋駅 歩3分 東急世田谷線/西太子堂駅 歩9分 東急田園都市線/池尻大橋駅 歩18分,築23年,4階,16.8万円,10000円,1LDK,39.48m2
ＡＫＫレジデンス新宿,東京都新宿区大久保２,東京メトロ副都心線/西早稲田駅 歩4分 都営大江戸線/東新宿駅 歩5分 ＪＲ山手線/新大久保駅 歩12分,築34年,7階,12.2万円,10000円,1LDK,35m2
ALPS八幡山ビル,東京都杉並区上高井戸１,京王線/八幡山駅 歩2分 京王井の頭線/高井戸駅 歩19分 京王線/芦花公園駅 歩11分,築34年,4階,14万円,5000円,2SDK,65.14m2
エスペランス幡ヶ谷,東京都渋谷区本町６,京王新線/幡ヶ谷駅 歩8分 京王新線/初台駅 歩15分 都営大江戸線/西新宿五丁目駅 歩17分,築18年,2階,9.7万円,0円,1K,30.5m2
コンフォートテラス,東京都世田谷区太子堂１,東急田園都市線/三軒茶屋駅 歩3分 東急世田谷線/西太子堂駅 歩9分 東急田園都市線/池尻大橋駅 歩15分,築25年,6階,16.3万円,9000円,1LDK,39.56m2
スカイヒル荻窪,東京都杉並区荻窪４,ＪＲ中央線/荻窪駅 歩9分 東京メトロ丸ノ内線/南阿佐ケ谷駅 歩24分 ＪＲ総武線/阿佐ケ谷駅 歩26分,築27年,3階,15.1万円,6000円,2DK,49.6m2
パレステュディオ笹塚,東京都世田谷区大原１,京王線/代田橋駅 歩5分 京王線/笹塚駅 歩7分 京王線/明大前駅 歩15分,築23年,11階,12万円,10000円,1DK,30.48m2
京王線 笹塚駅 地下1地上13階建 築23年,東京都世田谷区大原１,京王線/笹塚駅 歩7分 京王線/代田橋駅 歩5分 京王井の頭線/新代田駅 歩14分,築23年,11階,12万円,10000円,1DK,30.48m2
アークマーク大森町アジールコート,東京都大田区大森西５,京急本線/大森町駅 歩1分 京急本線/梅屋敷駅 歩8分 東京モノレール/昭和島駅 歩27分,築2年,2階,10.2万円,9000円,1DK,25.4m2
ルミエール大森,東京都大田区大森西２,京急本線/平和島駅 歩4分 京急本線/大森町駅 歩6分 ＪＲ京浜東北線/大森駅 歩24分,築26年,5階,9.9万円,10500円,1DK,33.3m2
京急本線 平和島駅 7階建 築26年,東京都大田区大森西２,京急本線/平和島駅 歩4分 京急本線/大森町駅 歩6分 ＪＲ京浜東北線/大森駅 歩24分,築26年,5階,9.9万円,10500円,1DK,33.3m2
パナッシュ二子玉川,東京都世田谷区玉川４,東急田園都市線/二子玉川駅 歩9分 東急大井町線/二子玉川駅 歩9分 東急田園都市線/用賀駅 歩18分,築17年,2階,12.1万円,6000円,1DK,30.06m2
グランヴァン南雪谷,東京都大田区南雪谷１,東急池上線/雪が谷大塚駅 歩6分 東急池上線/石川台駅 歩6分 東急東横線/多摩川駅 歩27分,築23年,1階,6.8万円,20000円,1K,26.18m2
シンシア三軒茶屋太子堂,東京都世田谷区太子堂１,東急田園都市線/三軒茶屋駅 歩7分 東急田園都市線/池尻大橋駅 歩9分 東急世田谷線/西太子堂駅 歩17分,築21年,8階,9万円,10000円,1K,21.45m2
東急田園都市線 三軒茶屋駅 10階建 築21年,東京都世田谷区太子堂１,東急田園都市線/三軒茶屋駅 歩7分 東急田園都市線/池尻大橋駅 歩9分 東急世田谷線/西太子堂駅 歩17分,築21年,8階,9万円,10000円,1K,21.45m2
パルムハウス初台,東京都渋谷区本町１,京王新線/幡ヶ谷駅 歩4分 京王新線/初台駅 歩6分 小田急線/代々木上原駅 歩19分,築49年,11階,9.8万円,5000円,1DK,31.47m2
リヴィコート下落合,東京都新宿区下落合１,西武新宿線/下落合駅 歩1分 ＪＲ山手線/高田馬場駅 歩13分 都営大江戸線/中井駅 歩12分,新築,4階,14.6万円,10000円,1LDK,32.04m2
パークアクシス南麻布,東京都港区南麻布１,東京メトロ南北線/麻布十番駅 歩4分 都営三田線/白金高輪駅 歩12分 都営大江戸線/赤羽橋駅 歩14分,築21年,10階,47.5万円,0円,1LDK,90.73m2
スタンフォードシティ,東京都世田谷区三軒茶屋２,東急田園都市線/三軒茶屋駅 歩10分 東急世田谷線/西太子堂駅 歩9分 東急田園都市線/駒沢大学駅 歩12分,築35年,2階,11万円,5000円,1LDK,35.63m2
東急田園都市線 三軒茶屋駅 6階建 築35年,東京都世田谷区三軒茶屋２,東急田園都市線/三軒茶屋駅 歩10分 東急世田谷線/西太子堂駅 歩9分 東急田園都市線/駒沢大学駅 歩12分,築35年,6階,11万円,5000円,1LDK,35.55m2
ハーモニーテラス上高井戸II,東京都杉並区上高井戸１,京王線/芦花公園駅 歩7分 京王線/八幡山駅 歩14分 京王井の頭線/高井戸駅 歩18分,築3年,2階,6万円,3500円,ワンルーム,11.39m2
HUNDRED STAY RESIDENCE,東京都新宿区百人町２,ＪＲ中央線/大久保駅 歩3分 ＪＲ山手線/新大久保駅 歩6分 ＪＲ山手線/新宿駅 歩17分,築32年,4階,41.3万円,12000円,2LDK,145.48m2
クレヴィアリグゼ雪が谷大塚,東京都大田区雪谷大塚町,東急池上線/雪が谷大塚駅 歩3分 東急東横線/田園調布駅 歩22分 東急池上線/石川台駅 歩16分,築6年,6階,11万円,10000円,1DK,25.08m2
飯田橋第二パーク・ファミリア,東京都新宿区新小川町,ＪＲ中央線/飯田橋駅 歩10分 東京メトロ有楽町線/江戸川橋駅 歩9分 東京メトロ東西線/神楽坂駅 歩13分,築44年,9階,20.8万円,10000円,2LDK,54.6m2
KINONE用賀,東京都世田谷区玉川台１,東急田園都市線/用賀駅 歩2分 東急田園都市線/桜新町駅 歩18分 東急田園都市線/二子玉川駅 歩20分,新築,2階,15.9万円,10000円,1LDK,41.85m2
品川プリンス・レジデンス,東京都港区高輪４,ＪＲ山手線/品川駅 歩4分 都営浅草線/高輪台駅 歩11分 ＪＲ山手線/五反田駅 歩16分,築29年,4階,24万円,0円,1LDK,60.01m2
ザ・グランクラッセ日本橋イースト,東京都中央区新川２,東京メトロ日比谷線/茅場町駅 歩4分 ＪＲ京葉線/八丁堀駅 歩5分 東京メトロ半蔵門線/水天宮前駅 歩11分,築4年,6階,37.2万円,20000円,3LDK,71.32m2
グリーニエ西新宿弐番館,東京都新宿区西新宿８,東京メトロ丸ノ内線/西新宿駅 歩3分 都営大江戸線/都庁前駅 歩10分 ＪＲ山手線/新宿駅 歩12分,築11年,2階,12.7万円,5000円,ワンルーム,30.78m2
イスタナ上北沢,東京都世田谷区上北沢１,京王線/上北沢駅 歩9分 京王線/桜上水駅 歩11分 京王線/八幡山駅 歩14分,築27年,1階,11.2万円,0円,2DK,44.25m2
プレール・ドゥーク本所吾妻橋VI,東京都墨田区東駒形２,都営浅草線/本所吾妻橋駅 歩5分 東京メトロ銀座線/浅草駅 歩7分 都営大江戸線/蔵前駅 歩14分,築2年,2階,10万円,10000円,1SK,25.59m2
コンフォリア学芸大学,東京都世田谷区下馬６,東急東横線/学芸大学駅 歩9分 東急田園都市線/三軒茶屋駅 バス10分 (バス停)下馬五丁目 歩5分 東急東横線/祐天寺駅 歩18分,築19年,4階,18.5万円,8000円,1LDK,42.11m2
シーズンフラッツ蔵前清澄通り,東京都墨田区本所１,都営大江戸線/蔵前駅 歩5分 都営浅草線/浅草駅 歩8分 東京メトロ銀座線/田原町駅 歩14分,新築,2階,11万円,10000円,1SK,26.07m2
シティハウス高南,東京都杉並区高円寺南２,ＪＲ中央線/高円寺駅 歩9分 東京メトロ丸ノ内線/新高円寺駅 歩3分 東京メトロ丸ノ内線/東高円寺駅 歩13分,築44年,2階,7.2万円,4000円,1DK,26.73m2
東京メトロ有楽町線 新富町駅 地下1地上14階建 築7年,東京都中央区入船２,東京メトロ有楽町線/新富町駅 歩3分 東京メトロ日比谷線/八丁堀駅 歩4分 都営浅草線/宝町駅 歩10分,築7年,4階,35万円,10000円,3LDK,71.87m2
ザ・パークハウス築地入船,東京都中央区入船２,東京メトロ有楽町線/新富町駅 歩3分 東京メトロ日比谷線/八丁堀駅 歩4分 都営浅草線/宝町駅 歩10分,築7年,4階,35万円,10000円,3LDK,71.87m2
都営大江戸線 両国駅 11階建 築4年,東京都墨田区緑１,都営大江戸線/両国駅 歩5分 都営新宿線/森下駅 歩9分 ＪＲ総武線/両国駅 歩10分,築4年,8階,19.1万円,20000円,2LDK,50.13m2
ルクレ墨田緑III,東京都墨田区緑１,都営大江戸線/両国駅 歩5分 ＪＲ総武線/両国駅 歩10分 都営大江戸線/森下駅 歩8分,築4年,8階,19.1万円,20000円,2LDK,50.13m2
TCRE 田園調布南,東京都大田区田園調布南,東急多摩川線/沼部駅 歩4分 東急池上線/御嶽山駅 歩14分 東急東横線/多摩川駅 歩15分,築35年,3階,7万円,6000円,1LDK,25.34m2
グリーンヒル新宿,東京都新宿区新宿７,東京メトロ副都心線/東新宿駅 歩4分 都営大江戸線/東新宿駅 歩4分 東京メトロ副都心線/西早稲田駅 歩11分,築55年,10階,21.5万円,0円,1SLDK,60m2
さくらクレール代々木公園,東京都渋谷区初台２,京王新線/初台駅 歩9分 小田急線/参宮橋駅 歩13分 小田急線/代々木上原駅 歩13分,築55年,4階,14.8万円,0円,1LDK,31.95m2
アーバネックス東京八丁堀,東京都中央区入船２,東京メトロ日比谷線/八丁堀駅 歩4分 東京メトロ有楽町線/新富町駅 歩5分 都営浅草線/宝町駅 歩11分,築1年,7階,22.2万円,20000円,2LDK,40.2m2
東京メトロ日比谷線 八丁堀駅 12階建 築1年,東京都中央区入船２,東京メトロ日比谷線/八丁堀駅 歩4分 ＪＲ京葉線/八丁堀駅 歩4分 東京メトロ日比谷線/築地駅 歩8分,築1年,7階,22.2万円,20000円,2LDK,40.2m2
シャトレ信濃町,東京都新宿区信濃町,東京メトロ丸ノ内線/四谷三丁目駅 歩7分 ＪＲ中央線/信濃町駅 歩7分 都営大江戸線/国立競技場駅 歩11分,築52年,7階,20.2万円,12000円,1LDK,40.82m2
東急田園都市線 三軒茶屋駅 6階建 築18年,東京都世田谷区三軒茶屋１,東急田園都市線/三軒茶屋駅 歩1分 東急世田谷線/西太子堂駅 歩8分 東急田園都市線/池尻大橋駅 歩20分,築18年,5階,8.7万円,15000円,1K,21.76m2
ヴァン・ヴェール百花園,東京都墨田区東向島３,東武伊勢崎線/東向島駅 歩7分 東武伊勢崎線/曳舟駅 歩10分 京成押上線/京成曳舟駅 歩10分,築11年,1階,10.5万円,3000円,1LDK,42.54m2
ヴァン・ヴェール百花園,東京都墨田区東向島３,東武伊勢崎線/東向島駅 歩7分 東武伊勢崎線/曳舟駅 歩10分 京成押上線/京成曳舟駅 歩10分,築11年,1階,10.5万円,3000円,1LDK,42.54m2
ＪＲ山手線 秋葉原駅 15階建 新築,東京都千代田区神田須田町２,ＪＲ山手線/秋葉原駅 歩5分 都営新宿線/岩本町駅 歩6分 東京メトロ銀座線/神田駅 歩6分,新築,2階,18.2万円,18000円,1LDK,38.99m2
スカイパレスビル,東京都新宿区高田馬場１,ＪＲ山手線/高田馬場駅 歩2分 東京メトロ副都心線/西早稲田駅 歩10分 西武新宿線/下落合駅 歩20分,築40年,8階,19万円,0円,2DK,57.28m2
アール・デコ錦糸町,東京都墨田区江東橋４,東京メトロ半蔵門線/錦糸町駅 歩7分 ＪＲ総武線快速/錦糸町駅 歩8分 都営新宿線/住吉駅 歩9分,築8年,4階,13万円,12000円,1LDK,41.01m2
トップルーム目黒,東京都目黒区下目黒２,ＪＲ山手線/目黒駅 歩8分 東急目黒線/不動前駅 歩11分 ＪＲ山手線/恵比寿駅 歩19分,築40年,2階,4.9万円,6000円,ワンルーム,9.96m2
都営新宿線 浜町駅 10階建 築10年,東京都中央区日本橋浜町３,都営新宿線/浜町駅 歩5分 東京メトロ半蔵門線/水天宮前駅 歩7分 東京メトロ日比谷線/人形町駅 歩11分,築10年,2階,17.8万円,12000円,1LDK,43.4m2
ガーラ・ヴィスタ日本橋浜町,東京都中央区日本橋浜町３,都営新宿線/浜町駅 歩5分 東京メトロ半蔵門線/水天宮前駅 歩7分 都営大江戸線/森下駅 歩10分,築10年,2階,17.8万円,12000円,1LDK,43.4m2
京成押上線 京成曳舟駅 5階建 新築,東京都墨田区東向島２,京成押上線/京成曳舟駅 歩3分 東武亀戸線/曳舟駅 歩4分 東武伊勢崎線/東向島駅 歩9分,新築,1階,20.9万円,15000円,2LDK,47.52m2
東京メトロ有楽町線 新富町駅 11階建 築4年,東京都中央区湊２,東京メトロ有楽町線/新富町駅 歩7分 東京メトロ日比谷線/八丁堀駅 歩9分 ＪＲ京葉線/八丁堀駅 歩9分,築4年,9階,19.4万円,15000円,1LDK,40.09m2
リテラス森下,東京都墨田区立川２,都営大江戸線/森下駅 歩6分 都営新宿線/菊川駅 歩7分 東京メトロ半蔵門線/清澄白河駅 歩15分,築3年,2階,16万円,15000円,1LDK,34.85m2
都営大江戸線 両国駅 9階建 築11年,東京都墨田区緑２,都営大江戸線/両国駅 歩10分 ＪＲ総武線/両国駅 歩15分 都営新宿線/菊川駅 歩9分,築11年,6階,21.5万円,15000円,2LDK,53.46m2
プレール・ドゥーク日本橋浜町,東京都中央区日本橋浜町１,都営浅草線/東日本橋駅 歩4分 都営新宿線/浜町駅 歩4分 ＪＲ総武線快速/馬喰町駅 歩8分,築3年,5階,16.9万円,15000円,1LDK,40.66m2
フェリーチェ錦糸町,東京都墨田区江東橋２,東京メトロ半蔵門線/錦糸町駅 歩7分 ＪＲ総武線/錦糸町駅 歩7分 東京メトロ半蔵門線/住吉駅 歩8分,築2年,14階,10.6万円,10000円,2K,25.6m2
カスタリア本駒込,東京都文京区本駒込６,ＪＲ山手線/巣鴨駅 歩5分 ＪＲ山手線/駒込駅 歩7分 都営三田線/千石駅 歩12分,築10年,4階,13.9万円,10000円,1LDK,37.26m2
東京メトロ日比谷線 小伝馬町駅 10階建 新築,東京都中央区日本橋堀留町１,東京メトロ日比谷線/小伝馬町駅 歩4分 都営浅草線/人形町駅 歩5分 東京メトロ銀座線/三越前駅 歩7分,新築,2階,17.6万円,12000円,1LDK,41.78m2
都営大江戸線 森下駅 11階建 築4年,東京都墨田区緑１,都営大江戸線/森下駅 歩6分 ＪＲ総武線/両国駅 歩10分 都営新宿線/菊川駅 歩15分,築4年,9階,18.5万円,10000円,2DK,43m2
ＪＲ総武線 錦糸町駅 15階建 築16年,東京都墨田区江東橋３,ＪＲ総武線/錦糸町駅 歩5分 東京メトロ半蔵門線/錦糸町駅 歩5分 東京メトロ半蔵門線/住吉駅 歩11分,築16年,7階,14.7万円,12000円,1LDK,40m2
東京メトロ日比谷線 秋葉原駅 12階建 築2年,東京都千代田区神田佐久間町４,東京メトロ日比谷線/秋葉原駅 歩6分 ＪＲ総武線/浅草橋駅 歩6分 都営新宿線/岩本町駅 歩7分,築2年,12階,17.6万円,10000円,1LDK,41.32m2
都営大江戸線 築地市場駅 11階建 築8年,東京都中央区銀座８,都営大江戸線/築地市場駅 歩4分 ＪＲ山手線/新橋駅 歩9分 東京メトロ日比谷線/東銀座駅 歩6分,築8年,6階,19万円,15000円,1LDK,41.29m2
フレールコート錦糸公園,東京都墨田区太平４,東京メトロ半蔵門線/錦糸町駅 歩5分 東京メトロ半蔵門線/押上駅 歩10分 ＪＲ総武線快速/錦糸町駅 歩8分,築7年,10階,16.8万円,12000円,1LDK,40.27m2
東京メトロ日比谷線 人形町駅 12階建 築20年,東京都中央区日本橋富沢町,東京メトロ日比谷線/人形町駅 歩5分 都営新宿線/馬喰横山駅 歩2分 ＪＲ総武線快速/馬喰町駅 歩8分,築20年,2階,17.1万円,6000円,1LDK,47.81m2
ＪＲ総武線 両国駅 10階建 築16年,東京都墨田区両国２,ＪＲ総武線/両国駅 歩4分 都営大江戸線/両国駅 歩9分 ＪＲ総武線快速/馬喰町駅 歩10分,築16年,4階,12.9万円,8000円,1LDK,42.3m2
GENOVIA押上II,東京都墨田区向島３,東京メトロ半蔵門線/押上駅 歩7分 東武伊勢崎線/とうきょうスカイツリー駅 歩9分 東武亀戸線/曳舟駅 歩10分,新築,2階,17.9万円,15000円,1LDK,41.04m2
東京メトロ日比谷線 茅場町駅 地下1地上13階建 築20年,東京都中央区日本橋小網町,東京メトロ日比谷線/茅場町駅 歩5分 東京メトロ半蔵門線/水天宮前駅 歩5分 都営浅草線/人形町駅 歩9分,築20年,5階,17.9万円,10000円,1LDK,45.03m2
ＪＲ総武線快速 錦糸町駅 12階建 築35年,東京都墨田区太平１,ＪＲ総武線快速/錦糸町駅 歩8分 東京メトロ半蔵門線/押上駅 歩10分 都営大江戸線/両国駅 歩22分,築35年,10階,17万円,8000円,3DK,57.24m2
Ｓハウス,東京都墨田区横川３,東京メトロ半蔵門線/押上駅 歩7分 ＪＲ総武線快速/錦糸町駅 歩7分 東京メトロ半蔵門線/錦糸町駅 歩7分,築24年,4階,10万円,0円,1LDK,33.21m2
グランドルチェ東日本橋,東京都中央区日本橋横山町,ＪＲ総武線快速/馬喰町駅 歩2分 都営新宿線/馬喰横山駅 歩3分 東京メトロ日比谷線/小伝馬町駅 歩5分,築10年,9階,15.3万円,6600円,1LDK,46.4m2
レジディア新川2,東京都中央区新川２,東京メトロ日比谷線/八丁堀駅 歩3分 東京メトロ東西線/茅場町駅 歩8分 東京メトロ有楽町線/新富町駅 歩12分,築21年,7階,25.4万円,15000円,2LDK,60.04m2
東京メトロ千代田線 千駄木駅 地下1地上10階建 築24年,東京都文京区千駄木３,東京メトロ千代田線/千駄木駅 歩3分 ＪＲ山手線/西日暮里駅 歩8分 ＪＲ山手線/日暮里駅 歩9分,築24年,7階,29.5万円,10000円,3LDK,66.77m2
セトルコート文京千石,東京都文京区千石４,都営三田線/千石駅 歩2分 ＪＲ山手線/巣鴨駅 歩10分 東京メトロ南北線/駒込駅 歩16分,築9年,7階,16.1万円,10000円,1SLDK,43.75m2
セトルコート文京千石,東京都文京区千石４,都営三田線/千石駅 歩2分 ＪＲ山手線/巣鴨駅 歩10分 東京メトロ南北線/駒込駅 歩16分,築9年,7階,16.1万円,10000円,1SLDK,43.75m2
クオリタス菊川,東京都墨田区立川２,都営新宿線/菊川駅 歩8分 都営大江戸線/森下駅 歩9分 ＪＲ総武線/両国駅 歩15分,築3年,2階,16.8万円,20000円,1LDK,42.92m2
カージェ文京千石,東京都文京区千石４,都営三田線/巣鴨駅 歩7分 ＪＲ山手線/巣鴨駅 歩7分 都営三田線/千石駅 歩9分,築3年,2階,18万円,15000円,1LDK,41.48m2
パークハビオ八丁堀,東京都中央区八丁堀３,東京メトロ日比谷線/八丁堀駅 歩3分 東京メトロ銀座線/京橋駅 歩7分 ＪＲ山手線/東京駅 歩15分,築16年,5階,19.8万円,10000円,1LDK,48.88m2
都営浅草線 東日本橋駅 8階建 築20年,東京都中央区東日本橋２,都営浅草線/東日本橋駅 歩3分 ＪＲ総武線快速/馬喰町駅 歩4分 都営新宿線/馬喰横山駅 歩5分,築20年,3階,14万円,12000円,1LDK,45.52m2
ハマハイツ隅田,東京都墨田区押上２,東武伊勢崎線/曳舟駅 歩3分 京成押上線/京成曳舟駅 歩6分 東京メトロ半蔵門線/押上駅 歩9分,築29年,4階,15.64万円,9600円,2LDK,54.78m2
東武伊勢崎線 曳舟駅 9階建 築29年,東京都墨田区押上２,東武伊勢崎線/曳舟駅 歩3分 京成押上線/京成曳舟駅 歩6分 東京メトロ半蔵門線/押上駅 歩9分,築29年,4階,15.64万円,9600円,2LDK,54.78m2
ＪＲ総武線 両国駅 9階建 築2年,東京都墨田区千歳１,ＪＲ総武線/両国駅 歩9分 都営大江戸線/森下駅 歩10分 都営新宿線/森下駅 歩10分,築2年,2階,11万円,10000円,2K,26.25m2
ＪＲ山手線 秋葉原駅 15階建 築17年,東京都千代田区岩本町３,ＪＲ山手線/秋葉原駅 歩5分 都営新宿線/岩本町駅 歩3分 東京メトロ日比谷線/小伝馬町駅 歩6分,築17年,5階,16万円,10000円,1LDK,41.13m2
ＪＲ山手線 神田駅 13階建 築9年,東京都千代田区内神田２,ＪＲ山手線/神田駅 歩3分 ＪＲ総武線快速/新日本橋駅 歩8分 東京メトロ丸ノ内線/淡路町駅 歩8分,築9年,7階,26.5万円,15000円,2LDK,52.18m2
東京メトロ東西線 竹橋駅 10階建 築3年,東京都千代田区神田錦町２,東京メトロ東西線/竹橋駅 歩5分 東京メトロ半蔵門線/大手町駅 歩6分 東京メトロ丸ノ内線/淡路町駅 歩10分,築3年,4階,18.3万円,17000円,1LDK,43.34m2
東京メトロ日比谷線 築地駅 地下1地上13階建 築19年,東京都中央区築地７,東京メトロ日比谷線/築地駅 歩4分 東京メトロ有楽町線/新富町駅 歩8分 都営浅草線/東銀座駅 歩10分,築19年,4階,18.7万円,8000円,1LDK,41.5m2
HF銀座レジデンスEAST,東京都中央区築地７,東京メトロ日比谷線/築地駅 歩4分 東京メトロ有楽町線/新富町駅 歩8分 都営浅草線/東銀座駅 歩10分,築19年,4階,18.7万円,8000円,1LDK,41.5m2
プラージュ　リュー　押上,東京都墨田区向島３,都営浅草線/押上駅 歩6分 東京メトロ半蔵門線/押上駅 歩6分 都営浅草線/本所吾妻橋駅 歩9分,築5年,4階,11.1万円,10000円,1DK,25.29m2
東京メトロ日比谷線 八丁堀駅 12階建 築19年,東京都中央区八丁堀３,東京メトロ日比谷線/八丁堀駅 歩4分 都営浅草線/宝町駅 歩5分 東京メトロ銀座線/京橋駅 歩9分,築19年,12階,18.8万円,12000円,1LDK,41.59m2
ドゥーエ両国3,東京都墨田区緑１,都営大江戸線/両国駅 歩4分 都営新宿線/森下駅 歩6分 東京メトロ半蔵門線/清澄白河駅 歩15分,築2年,9階,11万円,10000円,2K,25.65m2
Masaji-Toki,東京都文京区大塚１,東京メトロ有楽町線/護国寺駅 歩4分 東京メトロ丸ノ内線/茗荷谷駅 歩15分 東京メトロ有楽町線/江戸川橋駅 歩8分,築6年,3階,39.3万円,10000円,3LDK,81.21m2
ＪＲ総武線快速 錦糸町駅 4階建 築24年,東京都墨田区横川３,ＪＲ総武線快速/錦糸町駅 歩8分 東京メトロ半蔵門線/錦糸町駅 歩8分 東京メトロ半蔵門線/押上駅 歩8分,築24年,4階,10万円,0円,1LDK,33.21m2
R79番館　大手町,東京都千代田区内神田２,ＪＲ山手線/神田駅 歩5分 東京メトロ半蔵門線/大手町駅 歩4分 都営新宿線/小川町駅 歩9分,築2年,4階,19.4万円,10000円,1LDK,40.17m2
ライオンズフォーシア五反田,東京都品川区西五反田８,東急池上線/大崎広小路駅 歩4分 ＪＲ山手線/五反田駅 歩7分 ＪＲ埼京線/大崎駅 歩12分,築3年,3階,15.9万円,12000円,1LDK,31.72m2
