物件名,住所,アクセス,築年数,階数,家賃,管理費,間取り,広さ
パークホームズ日本橋人形町ザレジデンス,東京都中央区日本橋人形町２,東京メトロ日比谷線/人形町駅 歩3分 都営新宿線/浜町駅 歩5分 東京メトロ半蔵門線/水天宮前駅 歩6分,築6年,13階,43.5万円,0円,3LDK,72.51m2
東京メトロ半蔵門線 押上駅 4階建 築2年,東京都墨田区向島３,東京メトロ半蔵門線/押上駅 歩7分 東武伊勢崎線/とうきょうスカイツリー駅 歩3分 都営浅草線/本所吾妻橋駅 歩10分,築2年,4階,11.5万円,4000円,1LDK,30.65m2
オーキッドレジデンス銀座東,東京都中央区湊３,東京メトロ有楽町線/新富町駅 歩6分 ＪＲ京葉線/八丁堀駅 歩8分 東京メトロ日比谷線/築地駅 歩9分,築9年,5階,19.2万円,15000円,1LDK,44.86m2
アーク銀座京橋,東京都中央区八丁堀３,東京メトロ銀座線/京橋駅 歩5分 都営浅草線/宝町駅 歩2分 ＪＲ京葉線/八丁堀駅 歩6分,築16年,5階,15万円,8000円,1LDK,44.27m2
OUTER SPACE,東京都墨田区立川２,都営大江戸線/森下駅 歩6分 都営新宿線/菊川駅 歩10分 都営大江戸線/両国駅 歩9分,築4年,1階,15.1万円,8000円,1LDK,54.08m2
ドムス両国,東京都墨田区両国３,ＪＲ総武線/両国駅 歩7分 都営新宿線/森下駅 歩10分 都営大江戸線/両国駅 歩8分,築10年,4階,14.2万円,13000円,1LDK,42.22m2
パークアクシス日本橋茅場町ステーションゲート,東京都中央区日本橋茅場町２,東京メトロ日比谷線/茅場町駅 歩5分 ＪＲ京葉線/八丁堀駅 歩7分 東京メトロ東西線/日本橋駅 歩7分,新築,11階,19.5万円,15000円,1LDK,32.9m2
プレシス東神田,東京都千代田区東神田１,ＪＲ総武線快速/馬喰町駅 歩5分 都営新宿線/岩本町駅 歩6分 ＪＲ山手線/秋葉原駅 歩10分,築12年,6階,16万円,0円,1LDK,40.3m2
ＣＡＳＳＩＡ押上,東京都墨田区押上１,東京メトロ半蔵門線/押上駅 歩5分 都営浅草線/押上駅 歩5分 東武伊勢崎線/とうきょうスカイツリー駅 歩9分,築16年,3階,15.6万円,5000円,1LDK,39.79m2
ブリリアイスト文京六義園,東京都文京区本駒込６,都営三田線/千石駅 歩4分 ＪＲ山手線/巣鴨駅 歩8分 東京メトロ南北線/駒込駅 歩10分,新築,4階,14.5万円,10000円,1LDK,26.9m2
パークタワー秋葉原,東京都千代田区神田練塀町,ＪＲ山手線/秋葉原駅 歩4分 東京メトロ銀座線/末広町駅 歩6分 都営新宿線/岩本町駅 歩7分,築18年,6階,17.5万円,13000円,1LDK,41.29m2
レジディア日本橋浜町,東京都中央区日本橋浜町１,都営新宿線/浜町駅 歩3分 都営浅草線/東日本橋駅 歩3分 ＪＲ総武線快速/馬喰町駅 歩7分,築18年,10階,16.5万円,15000円,1LDK,41.14m2
パークキューブ春日安藤坂,東京都文京区春日２,都営大江戸線/飯田橋駅 歩8分 東京メトロ丸ノ内線/後楽園駅 歩10分 都営大江戸線/春日駅 歩10分,築19年,8階,25.7万円,12000円,2LDK,57.04m2
朝日マンション五反田,東京都品川区西五反田２,ＪＲ山手線/五反田駅 歩5分 東急池上線/大崎広小路駅 歩5分 東急目黒線/不動前駅 歩12分,築11年,4階,15.3万円,10000円,1LDK,35.27m2
パークルール大手町,東京都千代田区神田錦町１,東京メトロ丸ノ内線/淡路町駅 歩4分 ＪＲ山手線/神田駅 歩9分 東京メトロ千代田線/新御茶ノ水駅 歩4分,築2年,2階,17.8万円,20000円,1LDK,27.21m2
ディームス品川戸越II,東京都品川区東中延１,東急池上線/荏原中延駅 歩6分 都営浅草線/戸越駅 歩5分 東急大井町線/戸越公園駅 歩8分,築7年,14階,18.7万円,12000円,1LDK,41.89m2
トルナーレ日本橋浜町,東京都中央区日本橋浜町３,東京メトロ半蔵門線/水天宮前駅 歩5分 東京メトロ日比谷線/人形町駅 歩7分 都営新宿線/浜町駅 歩7分,築19年,9階,23.5万円,0円,1LDK,57.83m2
パークキューブ八丁堀,東京都中央区八丁堀４,東京メトロ日比谷線/八丁堀駅 歩1分 ＪＲ京葉線/八丁堀駅 歩1分 東京メトロ有楽町線/新富町駅 歩6分,築15年,2階,16.4万円,10000円,1LDK,41.67m2
柏屋ビル,東京都中央区日本橋人形町１,東京メトロ日比谷線/人形町駅 歩1分 東京メトロ半蔵門線/水天宮前駅 歩4分 東京メトロ東西線/茅場町駅 歩9分,築22年,2階,26万円,10000円,2LDK,68m2
レジディア水道橋,東京都千代田区神田三崎町３,ＪＲ中央線/水道橋駅 歩4分 東京メトロ東西線/飯田橋駅 歩7分 東京メトロ半蔵門線/九段下駅 歩7分,築20年,4階,30万円,15000円,2LDK,57.96m2
レジディア日本橋人形町2,東京都中央区日本橋人形町３,東京メトロ日比谷線/人形町駅 歩1分 東京メトロ半蔵門線/水天宮前駅 歩5分 都営新宿線/浜町駅 歩9分,築17年,9階,18.5万円,15000円,1LDK,45.13m2
モンシェール根津,東京都文京区根津１,東京メトロ千代田線/根津駅 歩5分 東京メトロ南北線/東大前駅 歩7分 東京メトロ千代田線/千駄木駅 歩6分,築36年,9階,12.9万円,10000円,1LDK,47.07m2
パークハビオ赤坂タワー,東京都港区赤坂２,東京メトロ千代田線/赤坂駅 歩5分 東京メトロ南北線/溜池山王駅 歩4分 東京メトロ銀座線/赤坂見附駅 歩7分,築9年,21階,35万円,15000円,2LDK,54.7m2
パークタワー芝浦ベイワード アーバンウイング,東京都港区芝浦２,ＪＲ山手線/田町駅 歩8分 新交通ゆりかもめ/芝浦ふ頭駅 歩7分 都営三田線/三田駅 歩9分,築19年,10階,23万円,8000円,1LDK,52.71m2
ラピス新宿南,東京都渋谷区千駄ヶ谷５,東京メトロ丸ノ内線/新宿三丁目駅 歩3分 ＪＲ山手線/代々木駅 歩5分 ＪＲ山手線/新宿駅 歩7分,築8年,4階,16.6万円,8000円,1LDK,35.42m2
ライズ代々木III,東京都渋谷区代々木１,ＪＲ山手線/代々木駅 歩6分 小田急線/南新宿駅 歩5分 ＪＲ山手線/新宿駅 歩11分,築4年,5階,18.4万円,15000円,1LDK,33.41m2
岩本町ビル,東京都千代田区岩本町１,ＪＲ総武線快速/馬喰町駅 歩4分 東京メトロ日比谷線/小伝馬町駅 歩5分 都営新宿線/馬喰横山駅 歩4分,築45年,4階,18万円,10000円,2DK,38.88m2
芝浦アイランドグローヴタワー,東京都港区芝浦４,ＪＲ山手線/田町駅 歩9分 都営浅草線/三田駅 歩10分 新交通ゆりかもめ/芝浦ふ頭駅 歩10分,築18年,17階,20万円,20000円,1LDK,47.06m2
湯島永谷マンション,東京都文京区湯島３,東京メトロ千代田線/湯島駅 歩2分 ＪＲ山手線/御徒町駅 歩7分 東京メトロ銀座線/上野広小路駅 歩5分,築51年,5階,12万円,0円,1LDK,38.11m2
ジオ四谷荒木町,東京都新宿区荒木町,東京メトロ丸ノ内線/四谷三丁目駅 歩5分 ＪＲ中央線/四ツ谷駅 歩9分 都営新宿線/曙橋駅 歩6分,築6年,4階,27.4万円,20000円,2LDK,55.75m2
ジオ四谷荒木町,東京都新宿区荒木町,東京メトロ丸ノ内線/四谷三丁目駅 歩5分 ＪＲ中央線/四ツ谷駅 歩9分 都営新宿線/曙橋駅 歩6分,築6年,4階,27.4万円,20000円,2LDK,55.75m2
グリシーヌ北馬込,東京都大田区北馬込２,都営浅草線/馬込駅 歩5分 東急大井町線/荏原町駅 歩8分 都営浅草線/中延駅 歩10分,築10年,1階,11.5万円,3000円,1SDK,36.23m2
フレンシア外苑西,東京都渋谷区千駄ヶ谷１,ＪＲ中央線/千駄ケ谷駅 歩5分 都営大江戸線/国立競技場駅 歩5分 東京メトロ副都心線/北参道駅 歩8分,築18年,3階,26.4万円,0円,1LDK,54.64m2
メゾン・ド・コリーヌ市ヶ谷,東京都新宿区市谷田町３,東京メトロ南北線/飯田橋駅 歩7分 東京メトロ南北線/市ケ谷駅 歩8分 都営大江戸線/牛込神楽坂駅 歩9分,築12年,5階,33.4万円,12000円,2LDK,78.82m2
ディールーム早稲田,東京都新宿区弁天町,東京メトロ東西線/早稲田駅 歩6分 東京メトロ東西線/神楽坂駅 歩8分 都営大江戸線/牛込柳町駅 歩8分,築6年,1階,15.2万円,3000円,1LDK,42.74m2
高輪ホワイトマンション,東京都港区高輪２,都営浅草線/泉岳寺駅 歩1分 ＪＲ山手線/高輪ゲートウェイ駅 歩5分 ＪＲ山手線/品川駅 歩8分,築52年,7階,24.9万円,0円,2LDK,72.72m2
秀和恵比寿レジデンス,東京都目黒区中目黒１,ＪＲ山手線/恵比寿駅 歩6分 東京メトロ日比谷線/中目黒駅 歩10分 東急東横線/代官山駅 歩7分,築54年,8階,12.3万円,0円,ワンルーム,34.46m2
アヴァンティーク東銀座,東京都中央区築地４,東京メトロ日比谷線/東銀座駅 歩3分 東京メトロ銀座線/銀座駅 歩8分 都営大江戸線/築地市場駅 歩6分,築20年,4階,15.1万円,9000円,2SK,41.46m2
カーサ蒲田,東京都大田区西蒲田７,ＪＲ京浜東北線/蒲田駅 歩3分 京急本線/京急蒲田駅 歩10分 東急池上線/蓮沼駅 歩9分,築49年,4階,6.9万円,5000円,1DK,23.61m2
プルメリア清水,東京都墨田区墨田４,京成押上線/八広駅 歩6分 東武伊勢崎線/鐘ヶ淵駅 歩7分 東武伊勢崎線/東向島駅 歩9分,築22年,1階,12.5万円,9000円,2LDK,56.02m2
シナリオ会館,東京都中央区日本橋人形町２,都営浅草線/人形町駅 歩5分 東京メトロ半蔵門線/水天宮前駅 歩5分 都営新宿線/浜町駅 歩6分,築21年,5階,35.5万円,15000円,3LDK,94.11m2
アーバネックス日本橋水天宮,東京都中央区日本橋蛎殻町１,東京メトロ半蔵門線/水天宮前駅 歩3分 東京メトロ日比谷線/人形町駅 歩5分 東京メトロ東西線/茅場町駅 歩6分,築4年,2階,21万円,15000円,2LDK,40.6m2
須賀町マンション,東京都新宿区須賀町,ＪＲ中央線/四ツ谷駅 歩8分 東京メトロ丸ノ内線/四谷三丁目駅 歩7分 ＪＲ中央線/信濃町駅 歩10分,築52年,4階,8.5万円,5000円,ワンルーム,29.1m2
ＲＥＬＵＸＩＡ墨田東向島,東京都墨田区東向島５,東武伊勢崎線/東向島駅 歩7分 東武伊勢崎線/鐘ヶ淵駅 歩7分 京成押上線/八広駅 歩8分,築2年,4階,13.2万円,20000円,1LDK,40.65m2
ブリリア一番町,東京都千代田区一番町,東京メトロ半蔵門線/半蔵門駅 歩3分 東京メトロ南北線/市ケ谷駅 歩8分 東京メトロ有楽町線/麹町駅 歩8分,築5年,6階,50万円,57000円,3LDK,94.24m2
Yushima　KWD　７,東京都文京区湯島２,都営大江戸線/本郷三丁目駅 歩5分 東京メトロ千代田線/湯島駅 歩8分 東京メトロ丸ノ内線/本郷三丁目駅 歩5分,新築,1階,15.6万円,5000円,1LDK,35.97m2
ＪＲ総武線 両国駅 8階建 築10年,東京都墨田区両国３,ＪＲ総武線/両国駅 歩7分 都営大江戸線/両国駅 歩8分 都営新宿線/森下駅 歩10分,築10年,4階,14.2万円,13000円,1LDK,42.22m2
プラウドフラット墨田曳舟ディアージュ,東京都墨田区東向島２,京成押上線/京成曳舟駅 歩3分 東武亀戸線/曳舟駅 歩4分 東武伊勢崎線/東向島駅 歩9分,新築,1階,20.9万円,15000円,2LDK,47.52m2
パークアクシス両国,東京都墨田区緑１,都営大江戸線/両国駅 歩6分 都営新宿線/森下駅 歩8分 ＪＲ総武線/両国駅 歩10分,築12年,7階,16.8万円,12000円,1LDK,43.02m2
グランカーサ本駒込,東京都文京区本駒込３,ＪＲ山手線/駒込駅 歩11分 東京メトロ南北線/本駒込駅 歩7分 都営三田線/千石駅 歩10分,築5年,4階,25.4万円,15000円,2LDK,56.36m2
ブリリアイスト両国,東京都墨田区両国１,ＪＲ総武線/両国駅 歩6分 都営浅草線/東日本橋駅 歩10分 都営大江戸線/森下駅 歩10分,築4年,7階,17.3万円,15000円,2DK,41.26m2
ミテッツァ千代田三崎町,東京都千代田区神田三崎町３,ＪＲ中央線/水道橋駅 歩5分 東京メトロ東西線/九段下駅 歩6分 東京メトロ半蔵門線/神保町駅 歩8分,築13年,7階,15.5万円,10000円,1DK,37.95m2
ザ・パークハビオ人形町レジデンス,東京都中央区日本橋久松町,東京メトロ日比谷線/人形町駅 歩5分 都営新宿線/浜町駅 歩6分 東京メトロ半蔵門線/水天宮前駅 歩10分,新築,4階,18万円,15000円,1LDK,31.61m2
フュージョナル日本橋浜町,東京都中央区日本橋浜町３,東京メトロ半蔵門線/水天宮前駅 歩4分 都営新宿線/浜町駅 歩8分 東京メトロ日比谷線/人形町駅 歩9分,築11年,10階,16.5万円,10000円,2DK,42.03m2
パークアクシス日本橋浜町レジデンス,東京都中央区日本橋浜町１,都営新宿線/浜町駅 歩2分 都営浅草線/東日本橋駅 歩5分 東京メトロ日比谷線/人形町駅 歩7分,築6年,7階,21.1万円,12000円,1LDK,40.87m2
都営新宿線 浜町駅 12階建 築6年,東京都中央区日本橋浜町１,都営新宿線/浜町駅 歩2分 ＪＲ総武線快速/馬喰町駅 歩7分 東京メトロ日比谷線/人形町駅 歩9分,築6年,6階,23.5万円,12000円,2LDK,45.43m2
グランジット千代田秋葉原,東京都千代田区神田佐久間町４,東京メトロ日比谷線/秋葉原駅 歩5分 ＪＲ総武線/浅草橋駅 歩6分 都営新宿線/岩本町駅 歩7分,築2年,2階,15万円,9000円,1LDK,35.44m2
コクヨーレ日本橋,東京都中央区日本橋堀留町２,都営浅草線/人形町駅 歩5分 東京メトロ日比谷線/小伝馬町駅 歩3分 都営新宿線/馬喰横山駅 歩6分,築19年,7階,14.9万円,15000円,1LDK,35.26m2
Ｌｅ　Ｃｏｃｏｎ　人形町,東京都中央区日本橋富沢町,東京メトロ日比谷線/人形町駅 歩4分 都営新宿線/浜町駅 歩7分 ＪＲ総武線快速/馬喰町駅 歩10分,築7年,9階,16.1万円,10000円,1LDK,41.82m2
東京メトロ日比谷線 人形町駅 10階建 築7年,東京都中央区日本橋富沢町,東京メトロ日比谷線/人形町駅 歩4分 都営新宿線/浜町駅 歩7分 ＪＲ総武線快速/馬喰町駅 歩10分,築7年,9階,16.1万円,10000円,1LDK,41.82m2
ブランシエスタ白山,東京都文京区白山１,都営三田線/白山駅 歩6分 都営大江戸線/春日駅 歩8分 東京メトロ南北線/東大前駅 歩10分,築5年,8階,15.9万円,10000円,1LDK,34.74m2
グレースレジデンス東京,東京都中央区新川２,ＪＲ京葉線/八丁堀駅 歩3分 東京メトロ東西線/茅場町駅 歩9分 東京メトロ日比谷線/八丁堀駅 歩7分,築17年,7階,18.2万円,10000円,1LDK,43.82m2
ルネ神田和泉町,東京都千代田区神田和泉町,ＪＲ山手線/秋葉原駅 歩6分 都営新宿線/岩本町駅 歩9分 東京メトロ銀座線/末広町駅 歩10分,築11年,3階,16.8万円,12000円,1LDK,44.48m2
エスティメゾン錦糸町2,東京都墨田区江東橋３,ＪＲ総武線/錦糸町駅 歩5分 東京メトロ半蔵門線/住吉駅 歩7分 都営新宿線/菊川駅 歩16分,築16年,7階,14.5万円,12000円,1LDK,40.05m2
カーサ内神田,東京都千代田区内神田１,ＪＲ山手線/神田駅 歩6分 東京メトロ丸ノ内線/淡路町駅 歩7分 東京メトロ千代田線/新御茶ノ水駅 歩6分,築9年,9階,16.8万円,10000円,1LDK,40.69m2
ズーム日本橋蛎殻町,東京都中央区日本橋蛎殻町１,東京メトロ半蔵門線/水天宮前駅 歩5分 東京メトロ日比谷線/茅場町駅 歩5分 東京メトロ銀座線/日本橋駅 歩10分,築4年,2階,20.2万円,20000円,1LDK,45.69m2
エンブレムコート明石町,東京都中央区明石町,東京メトロ有楽町線/新富町駅 歩7分 東京メトロ日比谷線/築地駅 歩8分 東京メトロ有楽町線/月島駅 歩8分,築22年,15階,20.5万円,15000円,1SK,55.46m2
コンフォリア秋葉原EAST,東京都千代田区東神田２,東京メトロ日比谷線/秋葉原駅 歩8分 ＪＲ総武線快速/馬喰町駅 歩6分 ＪＲ総武線/浅草橋駅 歩6分,築8年,2階,14.7万円,8000円,1DK,32.83m2
パークウッドレジデンス日本橋,東京都中央区日本橋堀留町２,東京メトロ日比谷線/小伝馬町駅 歩4分 都営浅草線/人形町駅 歩5分 都営新宿線/馬喰横山駅 歩4分,築12年,2階,18万円,8000円,1LDK,46.75m2
パークルール神田司町ロンド,東京都千代田区神田司町２,東京メトロ丸ノ内線/淡路町駅 歩4分 ＪＲ山手線/神田駅 歩6分 都営新宿線/小川町駅 歩4分,築6年,9階,17.2万円,10000円,1LDK,33.77m2
パークアクシス日本橋浜町,東京都中央区日本橋浜町１,都営新宿線/浜町駅 歩3分 都営浅草線/東日本橋駅 歩5分 東京メトロ日比谷線/人形町駅 歩8分,築18年,3階,20.6万円,10000円,1SLDK,50.07m2
クンラボーロ,東京都墨田区菊川２,都営新宿線/菊川駅 歩4分 都営新宿線/森下駅 歩9分 東京メトロ半蔵門線/清澄白河駅 歩10分,築9年,7階,16万円,13000円,1LDK,48.94m2
コスモグラシア人形町,東京都中央区日本橋富沢町,東京メトロ日比谷線/人形町駅 歩3分 都営新宿線/馬喰横山駅 歩6分 都営浅草線/東日本橋駅 歩7分,築15年,2階,16.5万円,10000円,1LDK,40.71m2
S-RESIDENCE錦糸町Norte,東京都墨田区横川５,東京メトロ半蔵門線/押上駅 歩8分 ＪＲ総武線/錦糸町駅 歩10分 都営浅草線/押上駅 歩8分,築2年,3階,16.45万円,10000円,1LDK,40.19m2
アーバネックス日本橋馬喰町,東京都中央区日本橋馬喰町２,ＪＲ総武線快速/馬喰町駅 歩2分 ＪＲ総武線/浅草橋駅 歩4分 東京メトロ日比谷線/秋葉原駅 歩10分,築2年,6階,12.5万円,15000円,1DK,25.81m2
プレジリア東日本橋,東京都中央区日本橋馬喰町２,ＪＲ総武線快速/馬喰町駅 歩2分 都営新宿線/馬喰横山駅 歩2分 都営浅草線/東日本橋駅 歩7分,築11年,8階,15.5万円,10000円,1LDK,40.01m2
東武伊勢崎線 東向島駅 7階建 新築,東京都墨田区東向島４,東武伊勢崎線/東向島駅 歩5分 京成押上線/京成曳舟駅 歩9分 東京メトロ半蔵門線/押上駅 歩20分,新築,1階,9.5万円,13000円,1DK,26.87m2
アイルプレミアム押上ノルド,東京都墨田区東向島４,東武伊勢崎線/東向島駅 歩4分 京成押上線/京成曳舟駅 歩7分 東武伊勢崎線/曳舟駅 歩8分,新築,3階,9.7万円,13000円,1DK,26.87m2
エピック東日本橋レジデンス,東京都中央区東日本橋２,都営浅草線/東日本橋駅 歩2分 ＪＲ総武線快速/馬喰町駅 歩4分 都営新宿線/馬喰横山駅 歩4分,築15年,3階,14.6万円,13000円,1LDK,40.75m2
プレールドゥーク東向島,東京都墨田区東向島４,東武伊勢崎線/東向島駅 歩3分 京成押上線/京成曳舟駅 歩8分 東武亀戸線/曳舟駅 歩10分,築3年,5階,14.1万円,10500円,1LDK,40.83m2
グランプラス千駄木,東京都文京区千駄木３,ＪＲ山手線/西日暮里駅 歩8分 ＪＲ山手線/日暮里駅 歩10分 東京メトロ千代田線/千駄木駅 歩5分,築11年,8階,15万円,8000円,1LDK,42.32m2
グランスイート銀座レスティモナーク,東京都中央区銀座８,東京メトロ日比谷線/東銀座駅 歩6分 ＪＲ山手線/新橋駅 歩8分 東京メトロ銀座線/銀座駅 歩9分,築19年,13階,22.8万円,10000円,1LDK,50.51m2
クロスフォー築地,東京都中央区築地４,東京メトロ日比谷線/築地駅 歩3分 都営大江戸線/築地市場駅 歩4分 都営浅草線/東銀座駅 歩5分,築17年,6階,16.1万円,7000円,1LDK,40.29m2
コートラクリア人形町,東京都中央区日本橋人形町１,東京メトロ日比谷線/人形町駅 歩2分 都営浅草線/人形町駅 歩2分 東京メトロ半蔵門線/水天宮前駅 歩3分,築8年,2階,14万円,15000円,1DK,32.78m2
ルマ・ワーワ,東京都文京区本郷２,東京メトロ丸ノ内線/本郷三丁目駅 歩4分 ＪＲ中央線/水道橋駅 歩9分 都営三田線/春日駅 歩7分,築7年,2階,15万円,4000円,1LDK,40.48m2
OZIO大手町,東京都千代田区神田錦町１,東京メトロ丸ノ内線/大手町駅 歩6分 都営新宿線/小川町駅 歩5分 東京メトロ丸ノ内線/淡路町駅 歩5分,築18年,2階,17.9万円,10000円,1LDK,40.49m2
KDXレジデンス千駄木,東京都文京区千駄木３,東京メトロ千代田線/千駄木駅 歩3分 ＪＲ山手線/西日暮里駅 歩8分 ＪＲ京浜東北線/日暮里駅 歩9分,築24年,7階,29.5万円,10000円,3LDK,66.77m2
CONTEL西五反田,東京都品川区西五反田７,ＪＲ山手線/五反田駅 歩7分 東急池上線/大崎広小路駅 歩6分 東急目黒線/不動前駅 歩8分,築5年,2階,8.9万円,6000円,ワンルーム,12.59m2
SHINKA,東京都中央区新川２,ＪＲ京葉線/八丁堀駅 歩2分 東京メトロ日比谷線/八丁堀駅 歩5分 東京メトロ東西線/茅場町駅 歩8分,築7年,9階,17万円,15000円,1LDK,47.32m2
ライオンズフォーシア神田須田町,東京都千代田区神田須田町２,ＪＲ山手線/秋葉原駅 歩5分 ＪＲ京浜東北線/神田駅 歩6分 都営新宿線/岩本町駅 歩4分,新築,2階,18.2万円,18000円,1LDK,38.99m2
福信館,東京都文京区千駄木３,東京メトロ千代田線/千駄木駅 歩4分 ＪＲ山手線/西日暮里駅 歩8分 ＪＲ山手線/日暮里駅 歩11分,築11年,8階,16.1万円,9500円,1LDK,42.28m2
CASSIA押上桜橋,東京都墨田区向島２,東京メトロ半蔵門線/押上駅 歩9分 京成押上線/押上駅 歩9分 都営浅草線/押上駅 歩11分,築2年,3階,15.9万円,15000円,1LDK,41.04m2
コンフォリア春日富坂,東京都文京区春日１,東京メトロ丸ノ内線/後楽園駅 歩6分 都営大江戸線/春日駅 歩8分 ＪＲ中央線/飯田橋駅 歩15分,築16年,7階,18.7万円,10000円,1LDK,42.94m2
東京メトロ丸ノ内線 淡路町駅 地下1地上12階建 築6年,東京都千代田区神田司町２,東京メトロ丸ノ内線/淡路町駅 歩4分 ＪＲ山手線/神田駅 歩6分 都営新宿線/小川町駅 歩4分,築6年,9階,17.2万円,10000円,1LDK,33.77m2
ムルーエ築地,東京都中央区築地１,東京メトロ日比谷線/築地駅 歩2分 東京メトロ有楽町線/新富町駅 歩3分 都営浅草線/東銀座駅 歩5分,築22年,9階,25万円,0円,2LDK,61.87m2
正金アパートメント入船,東京都中央区新富１,東京メトロ有楽町線/新富町駅 歩2分 ＪＲ京葉線/八丁堀駅 歩4分 東京メトロ日比谷線/築地駅 歩5分,築7年,5階,18.6万円,10000円,1LDK,38.28m2
ルフォンプログレ文京湯島,東京都文京区湯島３,東京メトロ千代田線/湯島駅 歩3分 東京メトロ銀座線/末広町駅 歩5分 ＪＲ山手線/御徒町駅 歩9分,築4年,4階,28万円,15000円,2LDK,53.26m2
プライムアーバン日本橋横山町,東京都中央区日本橋横山町,都営新宿線/馬喰横山駅 歩2分 ＪＲ総武線快速/馬喰町駅 歩3分 東京メトロ日比谷線/小伝馬町駅 歩5分,築16年,9階,17.1万円,8000円,1LDK,46.14m2
シーフォルム神田,東京都千代田区神田富山町,ＪＲ山手線/神田駅 歩4分 都営新宿線/岩本町駅 歩5分 ＪＲ総武線快速/新日本橋駅 歩8分,築12年,5階,18.6万円,10000円,1LDK,44.39m2
都営大江戸線 両国駅 5階建 築26年,東京都墨田区緑１,都営大江戸線/両国駅 歩6分 都営新宿線/森下駅 歩7分 ＪＲ総武線/両国駅 歩11分,築26年,4階,11.5万円,5000円,2DK,46.98m2
ニューシティアパートメンツ新川2,東京都中央区新川２,ＪＲ京葉線/八丁堀駅 歩3分 東京メトロ日比谷線/茅場町駅 歩4分 ＪＲ山手線/東京駅 歩13分,築18年,1階,21万円,10000円,1LDK,59.45m2
レ クロシェット,東京都千代田区飯田橋２,ＪＲ中央線/水道橋駅 歩7分 東京メトロ半蔵門線/九段下駅 歩5分 東京メトロ東西線/飯田橋駅 歩10分,新築,9階,21.6万円,8800円,1LDK,48.04m2
サイプレス日本橋本町,東京都中央区日本橋本町４,ＪＲ総武線快速/新日本橋駅 歩2分 ＪＲ山手線/神田駅 歩5分 東京メトロ銀座線/三越前駅 歩4分,築6年,11階,19.3万円,10000円,1LDK,38.37m2
レジディア三越前,東京都中央区日本橋本町３,ＪＲ総武線快速/新日本橋駅 歩2分 東京メトロ銀座線/三越前駅 歩6分 ＪＲ山手線/神田駅 歩11分,築19年,10階,15.5万円,15000円,1LDK,40.7m2
ＪＲ総武線快速 新日本橋駅 15階建 築19年,東京都中央区日本橋本町３,ＪＲ総武線快速/新日本橋駅 歩2分 東京メトロ日比谷線/小伝馬町駅 歩3分 東京メトロ銀座線/三越前駅 歩5分,築19年,10階,15.5万円,15000円,1LDK,40.7m2
CREVISTA東向島,東京都墨田区東向島６,京成押上線/京成曳舟駅 歩7分 東武伊勢崎線/東向島駅 歩7分 京成押上線/八広駅 歩9分,新築,2階,8.45万円,15000円,1K,25.5m2
レジディア市谷砂土原,東京都新宿区市谷砂土原町３,都営大江戸線/牛込神楽坂駅 歩6分 東京メトロ有楽町線/市ケ谷駅 歩8分 ＪＲ中央線/飯田橋駅 歩8分,築16年,4階,105万円,0円,4LDK,181.6m2
アーバネックス両国,東京都墨田区両国１,ＪＲ総武線/両国駅 歩5分 ＪＲ総武線/浅草橋駅 歩11分 ＪＲ総武線快速/馬喰町駅 歩12分,築2年,10階,12万円,10000円,1DK,25.55m2
クラッシィハウス神田美土代町,東京都千代田区内神田１,東京メトロ丸ノ内線/淡路町駅 歩4分 東京メトロ千代田線/新御茶ノ水駅 歩4分 ＪＲ山手線/神田駅 歩6分,築9年,7階,24万円,15000円,1LDK,48.12m2
